"id","title","date","image","list_price","list_price_2","selling_price","description","active_ingredient","therapeutic_action","distributor_product_id","supplier_product_id","timestamp","category_id","enterprise_supplier_product_id","status"
694,BASKEN 4 PERRO GDE. X 4 COMP.,2024-12-04,products/dfv/reduced/prod_170083_red.jpg,0.00,0.00,0.00,Desc. BASKEN 4 PERRO GDE. X 4 COMP.," Cada 100 gramos contiene: Pamoato de Pirantel 24,17 gramos; Pamoato de Oxantel 23,33 gramos; Oxfendazol 18,83 gramos; Praziquantel 8,33 gramos;",Antiparasitario interno de amplio espectro.,"170083","",2025-12-26 01:01:55.769 -0300,3,1070,1
920,FIPRO LABYES 41-60 KGS.,2025-07-12,products/dfv/reduced/prod_210253_red.jpg,0.00,0.00,0.00,Desc. FIPRO LABYES 41-60 KGS.,Fipronil,"Antiparasitario externo contra pulgas, garrapatas.","210253","",2025-12-26 01:02:05.224 -0300,4,1599,1
140,MELTRA GOLD 20 KG X 2 COMP (1 C/10 KG),2024-02-16,products/dfv/reduced/prod_240636_red.jpg,0.00,0.00,0.00,Desc. MELTRA GOLD 20 KG X 2 COMP (1 C/10 KG),"Oxbendazol, Praziquantel","Antiparasitario interno para el control de nematodos intestinales, tenias y giardias.","240636","",2025-12-26 01:02:07.263 -0300,3,9,1
142,MELTRA ENDECTOCIDA 3.15 X 500 ML,2024-02-16,products/dfv/reduced/prod_240639_red.jpg,0.00,0.00,0.00,Desc. MELTRA ENDECTOCIDA 3.15 X 500 ML,Ivermectina 1%,Antiparasitario externo e interno.,"240639","",2025-12-26 01:02:07.315 -0300,3,9,1
654,TOLTRAZOL CAJA X 3 COMP,2024-10-29,products/dfv/reduced/prod_261150_red.jpg,0.00,0.00,0.00,Desc. TOLTRAZOL CAJA X 3 COMP,Toltrazuril 200 g.,Coccidicida de amplio espectro.,"261150","",2025-12-26 01:02:09.909 -0300,3,945,1
921,BAYCOX X 1 LITRO,2025-07-12,products/dfv/reduced/prod_21040_red.jpg,0.00,0.00,0.00,Desc. BAYCOX X 1 LITRO,"Toltrazuril 2,5 grs.",Trat. y control de infecciones por coccidias aviares.,"21040","",2025-12-26 01:02:05.376 -0300,2,1598,0
251,"",2024-05-08,"",0.00,0.00,0.00,Desc. ,"","","9982004","",2024-05-09 01:00:54.130 -0300,,3,0
261,"",2024-05-08,"",0.00,0.00,0.00,Desc. ,"","","99822006","",2024-05-09 01:00:54.565 -0300,,3,0
271,"",2024-05-08,"",0.00,0.00,0.00,Desc. ,"","","998261","",2024-05-09 01:00:54.888 -0300,,3,0
281,"",2024-05-08,"",0.00,0.00,0.00,Desc. ,"","","998444","",2024-05-09 01:00:55.096 -0300,,3,0
291,"",2024-05-08,"",0.00,0.00,0.00,Desc. ,"","","998709","",2024-05-09 01:00:55.442 -0300,,3,0
812,CIDAR GATOS 1.5 A 3 KG,2025-05-13,products/dfv/reduced/prod_170111_red.jpg,0.00,0.00,0.00,Desc. CIDAR GATOS 1.5 A 3 KG,Spinosad 90 mg / Selamectina 18 mg,"Antiparasitario interno y externo palatable. Actúa contra pulgas, garrapatas, ácaros, gusanos del corazón y nematodos gastrointestinales. Previene la dirofilariosis.","170111","",2025-12-26 01:01:56.062 -0300,4,1070,1
737,TEA 327 COLLAR PERRO CHICO Y MEDIANO,2024-12-04,products/dfv/reduced/prod_170375_red.jpg,0.00,0.00,0.00,Desc. TEA 327 COLLAR PERRO CHICO Y MEDIANO,Propoxur 10 g.,Antiparasitario externo.,"170375","",2025-12-26 01:01:58.132 -0300,4,1070,1
1239,SULTRIGEN PLUS X 100 ML,2025-11-30,enterprises/logo-tecnovax.jpg,0.00,0.00,0.00,Desc. SULTRIGEN PLUS X 100 ML,"","","25146","",2025-12-26 01:00:58.387 -0300,1,1763,1
301,MELOXIVET 4 MG X 10 COMP.,2024-05-09,products/dfv/reduced/prod_160051_red.jpg,0.00,0.00,0.00,Desc. MELOXIVET 4 MG X 10 COMP.,Meloxicam 4 mg.,Antiinflamatorio no esteroide.,"160051","",2025-12-26 01:01:52.088 -0300,2,18,1
1073,OSS. GROOMER DESATANUDOS X 130 ML,2025-10-26,enterprises/Osspret-logo_IFJyAFN.jpg,0.00,0.00,0.00,Desc. OSS. GROOMER DESATANUDOS X 130 ML,Queratina,Desatanudos. Otorga suavidad y sedosidad al pelo,"270178","",2025-12-26 01:01:10.516 -0300,5,1714,1
695,BASKEN 4 PERRO GIGANTE X 3 COMP.,2024-12-04,products/dfv/reduced/prod_170084_red.jpg,0.00,0.00,0.00,Desc. BASKEN 4 PERRO GIGANTE X 3 COMP.," Cada 100 gramos contiene: Pamoato de Pirantel 24,17 gramos; Pamoato de Oxantel 23,33 gramos; Oxfendazol 18,83 gramos; Praziquantel 8,33 gramos;",Antiparasitario interno de amplio espectro.,"170084","",2025-12-26 01:01:55.816 -0300,3,1070,1
763,SERENEX DIFUSOR CANINO 42 ML,2024-12-04,products/dfv/reduced/prod_170980_red.jpg,0.00,0.00,0.00,Desc. SERENEX DIFUSOR CANINO 42 ML,Feromona M2B,"Difusor eléctrico – Feromonoterapia, Feromonas de sincronía que calman y tranquilizan","170980","",2025-12-26 01:01:59.390 -0300,2,1070,1
118,POWER  GOLD DE 04 A 10 KG 12SEM,2024-02-16,products/dfv/reduced/prod_240202_red.jpg,0.00,0.00,0.00,Desc. POWER  GOLD DE 04 A 10 KG 12SEM,"Fluralaner  13,64 % p/p",Antiparasitario externo pulguicida y garrapaticida,"240202","",2025-12-26 01:02:05.700 -0300,4,9,1
126,DRIPTOL 25 MG X 20 COMP.,2024-02-16,products/dfv/reduced/prod_240367_red.jpg,0.00,0.00,0.00,Desc. DRIPTOL 25 MG X 20 COMP.,Carprofeno 25mg,"Analgésico, antiinflamatorio, antipirético","240367","",2025-12-26 01:02:06.392 -0300,2,9,1
887,PROTECH GATOS DE 5 A 8KG.,2025-07-12,products/dfv/reduced/prod_210083_red.jpg,0.00,0.00,0.00,Desc. PROTECH GATOS DE 5 A 8KG.,"Piriproxifeno, Imidacloprid.","Antiparasitario externo contra pulgas, garrapatas y mosquitos.","210083","",2025-12-26 01:02:02.351 -0300,4,1599,1
902,OSTEO CART PLUS X 30 COMP.,2025-07-12,products/dfv/reduced/prod_210142_red.jpg,0.00,0.00,0.00,Desc. OSTEO CART PLUS X 30 COMP.,"Glucosamina 220,87 mg, DL-Metionina 52,2 mg, L-Cisteína 8,35 mg, Betaína 4,18 mg, Histidina 4,18 mg, Vitamina B6 8,35 mg, Vitamina E 6,26 mg, Gluconato de Zinc 16,91 mg, Gluconato de Magnesio 10,46 mg, Gluconato de Manganeso 10,46 mg, Glicinato de Cobre 1,46 mg, Selenito de Sodio 0,005 mg,",Regenerador osteoarticular.,"210142","",2025-12-26 01:02:04.970 -0300,6,1599,1
143,PRAGMA  2.5 MG X 20 COMP,2024-02-16,products/dfv/reduced/prod_240656_red.jpg,0.00,0.00,0.00,Desc. PRAGMA  2.5 MG X 20 COMP,"Benazepril clorhidrato  2,5 mg
Espironolactona  10 mg
Excipientes c.s.p.  500 mg
Cada comprimido de 1000 mg contiene:
Benazepril clorhidrato  5 mg
Espironolactona  20 mg
Excipientes c.s.p.  1000 mg
Cada comprimido de 2000 mg contiene:
Benazepril clorhidrato  10 mg
Espironolactona  40 mg
Excipientes c.s.p.  2000 mg",Inhibidor de la Enzima Convertidora de Angiotensina I y antagonista de la aldosterona.,"240656","",2025-12-26 01:02:07.364 -0300,7,9,1
963,GETS HOSPITALARIO X 150 COMP. H63KG,2025-08-07,enterprises/logo-idv.png,0.00,0.00,0.00,Desc. GETS HOSPITALARIO X 150 COMP. H63KG,"","","325062","",2025-12-26 01:01:25.676 -0300,4,1650,1
1140,OSS. SH. POTENCIADO ANTI. X 5 LITROS,2025-10-26,products/dfv/reduced/prod_270650_red.jpg,0.00,0.00,0.00,Desc. OSS. SH. POTENCIADO ANTI. X 5 LITROS,Alquitrán Vegetal y Acido Salicílico.,Shampoo para dermatitis y dermatosis húmedas.,"270650","",2025-12-26 01:02:38.995 -0300,5,1714,1
990,PYO DERM 125 MG. X 180 C (15BL),2025-08-07,products/dfv/reduced/prod_325121_red.jpg,0.00,0.00,0.00,Desc. PYO DERM 125 MG. X 180 C (15BL),"Cefalexina, Zinc, Biotina.",Antibiótico Beta Lactámico.,"325121","",2025-12-26 01:02:49.843 -0300,2,1650,1
65,CARDIAL B 10MG. PALAT X 20 COMP.,2024-02-01,products/dfv/reduced/prod_120209_red.jpg,0.00,0.00,0.00,Desc. CARDIAL B 10MG. PALAT X 20 COMP.,"Benazepril  10 mg., Espironolactona 40 mg.",Insuficiencia cardíaca en perros debido a insuficiencia valvular Cardiomiopatía dilatada. El Benazepril actúa como vasodilatador mixto. ,"120209","",2025-12-26 01:01:27.120 -0300,7,8,1
72,ECTHOL GMP PERROS H/10 KG.,2024-02-01,products/dfv/reduced/prod_120216_red.jpg,0.00,0.00,0.00,Desc. ECTHOL GMP PERROS H/10 KG.,Imidacloprid 100 mg. Cifenotrina 400 mg.,"Pulg, garrap y repelente de insectos con acción residual.","120216","",2025-12-26 01:01:28.708 -0300,4,8,1
1240,CEFALGEN 1000 X 80 COMP. (16 BL),2025-11-30,enterprises/logo-tecnovax.jpg,0.00,0.00,0.00,Desc. CEFALGEN 1000 X 80 COMP. (16 BL),"","","25147","",2025-12-26 01:00:58.484 -0300,1,1763,1
1074,OSS. LOCION A2 CON AVENA Y ALOE X 50 ML,2025-10-26,enterprises/Osspret-logo_IFJyAFN.jpg,0.00,0.00,0.00,Desc. OSS. LOCION A2 CON AVENA Y ALOE X 50 ML, Avena Coloidal 2% y Aloe vera 2%.,"Loción Humectante. Perfuma, Suaviza y da brillo.","270180","",2025-12-26 01:01:10.519 -0300,5,1714,1
816,CIDAR PERROS 12 A 25 KG,2025-05-13,products/dfv/reduced/prod_170116_red.jpg,0.00,0.00,0.00,Desc. CIDAR PERROS 12 A 25 KG,Spinosad 750 mg / Selamectina 150 mg,"Antiparasitario interno y externo palatable. Actúa contra pulgas, garrapatas, ácaros, gusanos del corazón y nematodos gastrointestinales (ascáridos, anquilostómidos, tricúridos). Previene la dirofilariosis","170116","",2025-12-26 01:01:56.231 -0300,4,1070,1
738,TEA LARVOX AEROSOL X 419 ML(V),2024-12-04,products/dfv/reduced/prod_170385_red.jpg,0.00,0.00,0.00,Desc. TEA LARVOX AEROSOL X 419 ML(V),"Piretrinas naturales 0,10 g. Metoprene 0,15 g. Propoxur 1,00 g. DDVP 0,47g. Butóxido de Piperonilo 0,40 g",Pulguicida y garrapacida ambiental.,"170385","",2025-12-26 01:01:58.524 -0300,4,1070,1
50,PRO AGE TONIPET X 21 COMP. HOLLYDAY,2024-02-01,products/dfv/reduced/prod_120113_red.jpg,0.00,0.00,0.00,Desc. PRO AGE TONIPET X 21 COMP. HOLLYDAY,"Taurina, vitaminas Coenzima, Gluconato de Mag.",Suplemento coadyuvante en el tratamiento de animales con cardiopatía o predispuestos a sufrirla.,"120113","",2025-12-26 01:01:19.738 -0300,7,8,1
71,ECTHOL GMP PERROS H/20 KG.,2024-02-01,products/dfv/reduced/prod_120217_red.jpg,0.00,0.00,0.00,Desc. ECTHOL GMP PERROS H/20 KG.,Imidacloprid 100 mg. Cifenotrina 400 mg.,"Pulg, garrap y repelente de insectos con acción residual.","120217","",2025-12-26 01:01:29.175 -0300,4,8,1
342,BLOCK SPINO 30 A 40 KG XL COMPRIMIDO,2024-05-09,products/dfv/reduced/prod_160229_red.jpg,0.00,0.00,0.00,Desc. BLOCK SPINO 30 A 40 KG XL COMPRIMIDO,Spinosad,Antiparasitario Externo,"160229","",2025-12-26 01:01:53.921 -0300,4,18,1
765,SERENEX REPUESTO CANINO 42 ML,2024-12-04,products/dfv/reduced/prod_170981_red.jpg,0.00,0.00,0.00,Desc. SERENEX REPUESTO CANINO 42 ML,Feromona M2B,"Difusor eléctrico – Feromonoterapia, Feromonas de sincronía que calman y tranquilizan","170981","",2025-12-26 01:01:59.429 -0300,2,1070,1
697,CESTODAN INYECTABLE X 10 ML,2024-12-04,products/dfv/reduced/prod_170100_red.jpg,0.00,0.00,0.00,Desc. CESTODAN INYECTABLE X 10 ML,Praziquantel 55 mg.,Tenicida total de amplio espectro.,"170100","",2025-12-26 01:01:55.866 -0300,3,1070,1
889,LABYDERM SHAMPOO SUAVE X 220 ML,2025-07-12,products/dfv/reduced/prod_210085_red.jpg,0.00,0.00,0.00,Desc. LABYDERM SHAMPOO SUAVE X 220 ML,Componentes hipoalergénicos de origen natural.,Protege la piel de agresiones externas.,"210085","",2025-12-26 01:02:03.677 -0300,2,1599,1
903,OSTEO CART PLUS X 120 COMP.,2025-07-12,products/dfv/reduced/prod_210143_red.jpg,0.00,0.00,0.00,Desc. OSTEO CART PLUS X 120 COMP.,"Glucosamina 220,87 mg, DL-Metionina 52,2 mg, L-Cisteína 8,35 mg, Betaína 4,18 mg, Histidina 4,18 mg, Vitamina B6 8,35 mg, Vitamina E 6,26 mg, Gluconato de Zinc 16,91 mg, Gluconato de Magnesio 10,46 mg, Gluconato de Manganeso 10,46 mg, Glicinato de Cobre 1,46 mg, Selenito de Sodio 0,005 mg,",Regenerador osteoarticular.,"210143","",2025-12-26 01:02:04.849 -0300,6,1599,1
1141,OSS. SH. MAXIMO NEGRO X 5 LT.,2025-10-26,products/dfv/reduced/prod_270617_red.jpg,0.00,0.00,0.00,Desc. OSS. SH. MAXIMO NEGRO X 5 LT.,Idem,Shampoo tonalizador sin tintura.,"270617","",2025-12-26 01:02:38.969 -0300,5,1714,1
991,PREDNISOLONA PYO 5 X 12 COMP.,2025-08-07,products/dfv/reduced/prod_325123_red.jpg,0.00,0.00,0.00,Desc. PREDNISOLONA PYO 5 X 12 COMP.,Prednisolona.,Glucocorticoide.,"325123","",2025-12-26 01:02:49.921 -0300,2,1650,1
1241,CEFALGEN 500 X 96 COMP. (12 BL),2025-11-30,enterprises/logo-tecnovax.jpg,0.00,0.00,0.00,Desc. CEFALGEN 500 X 96 COMP. (12 BL),"","","25148","",2025-12-26 01:00:58.486 -0300,1,1763,1
40,VITAMINICO AED K PAJAROS X 5 ML,2024-02-01,products/dfv/reduced/prod_120089_red.jpg,0.00,0.00,0.00,Desc. VITAMINICO AED K PAJAROS X 5 ML,Vitamina A: 2.000.000 U.I. Vitamina D: 400.000 U.I. Vitamina E: 120 mg. Vitamina K: 100 mg.,Multivitamínico.,"120089","",2025-12-26 01:01:08.462 -0300,2,8,1
115,ECTHOL HALO COLLAR CHICO X 40 CM,2024-02-16,products/dfv/reduced/prod_120454_red.jpg,0.00,0.00,0.00,Desc. ECTHOL HALO COLLAR CHICO X 40 CM,"Imidacloprid 10, 00 g, Deltametrina 3,10 g","antiparasitario externo para el control de pulgas y garrapatas y repelencia de flebótomos, moscas y mosquitos","120454","",2025-12-26 01:01:46.609 -0300,9,8,1
302,BLOCK PIP. ECO (10-25 KG) X 2.5 ML,2024-05-09,products/dfv/reduced/prod_160053_red.jpg,0.00,0.00,0.00,Desc. BLOCK PIP. ECO (10-25 KG) X 2.5 ML,"Permetrina, Imidacloprid, Piriproxifeno",Pulguicida y garrapaticida. Repelente de mosq.,"160053","",2025-12-26 01:01:52.036 -0300,4,18,1
818,CIDAR PERROS 25 A 50 KG,2025-05-13,products/dfv/reduced/prod_170117_red.jpg,0.00,0.00,0.00,Desc. CIDAR PERROS 25 A 50 KG,Spinosad 1500 mg / Selamectina 300 mg,"Antiparasitario interno y externo palatable. Actúa contra pulgas, garrapatas, ácaros, gusanos del corazón y nematodos gastrointestinales (ascáridos, anquilostómidos, tricúridos). Previene la dirofilariosis","170117","",2025-12-26 01:01:56.326 -0300,4,1070,1
698,DIAFIN 2 INY. X 20 ML,2024-12-04,products/dfv/reduced/prod_170150_red.jpg,0.00,0.00,0.00,Desc. DIAFIN 2 INY. X 20 ML,"Clorhidrato de Bencetimida 0,165 mg.","Antidiarreico, modulador de la motilidad intestinal.","170150","",2025-12-26 01:01:56.624 -0300,2,1070,1
310,CEPHILEXINE 500 MG X 50 COMP(CEFALEXINA),2024-05-09,products/dfv/reduced/prod_160062_red.jpg,0.00,0.00,0.00,Desc. CEPHILEXINE 500 MG X 50 COMP(CEFALEXINA),Cefalexina,Antibiótico. Comprimidos ranurados.,"160062","",2025-12-26 01:01:52.398 -0300,2,18,1
699,CESTODAN X  4 COMP,2024-12-04,products/dfv/reduced/prod_170110_red.jpg,0.00,0.00,0.00,Desc. CESTODAN X  4 COMP,Praziquantel 25 mg.,Tenicida total de amplio espectro.,"170110","",2025-07-28 01:01:43.459 -0300,3,1070,1
739,TEA 327 POLVO X 80 GR,2024-12-04,products/dfv/reduced/prod_170380_red.jpg,0.00,0.00,0.00,Desc. TEA 327 POLVO X 80 GR,Propoxur 1 g.,"Infestación por pulgas, garrapatas y piojos, especialmente en cachorros. ","170380","",2025-12-26 01:01:58.161 -0300,4,1070,1
740,TEA LARVOX FOGGER  X 419 ML(B),2024-12-04,products/dfv/reduced/prod_170386_red.jpg,0.00,0.00,0.00,Desc. TEA LARVOX FOGGER  X 419 ML(B),Fenoxicarb.,Pulguicida y garrapacida ambiental.,"170386","",2025-12-26 01:01:58.412 -0300,4,1070,1
322,ENROFLOXACINA 5% INY X 50 ML.JMARTIN,2024-05-09,products/dfv/reduced/prod_160102_red.jpg,0.00,0.00,0.00,Desc. ENROFLOXACINA 5% INY X 50 ML.JMARTIN,Enrofloxacina,Antibiótico bactericida.,"160102","",2025-12-26 01:01:52.933 -0300,2,18,1
264,"",2024-05-08,"",0.00,0.00,0.00,Desc. ,"","","99825","",2024-05-09 01:00:54.920 -0300,,3,0
762,SERENEX DIFUSOR FELINO 42 ML,2024-12-04,products/dfv/reduced/prod_170982_red.jpg,0.00,0.00,0.00,Desc. SERENEX DIFUSOR FELINO 42 ML,Feromona M2B,"Difusor eléctrico – Feromonoterapia, Feromonas de sincronía que calman y tranquilizan","170982","",2025-12-26 01:01:59.475 -0300,2,1070,1
890,PROTECH FIPRONIL SPRAY X 100 ML,2025-07-12,products/dfv/reduced/prod_210088_red.jpg,0.00,0.00,0.00,Desc. PROTECH FIPRONIL SPRAY X 100 ML,"Piriproxifeno, Imidacloprid, Butóxido de piperonilo, Permetrina","Antiparasitario externo contra pulgas, garrapatas y mosquitos.","210088","",2025-12-26 01:02:02.522 -0300,4,1599,1
1075,OSS. SH. REFRESCANTE X 250 ML,2025-10-26,products/dfv/reduced/prod_270190_red.jpg,0.00,0.00,0.00,Desc. OSS. SH. REFRESCANTE X 250 ML,"Menta, alcanfor, aloe.",Shampoo refrescante suavizante.,"270190","",2025-12-26 01:02:36.767 -0300,5,1714,1
1142,OSS. LIMPIALAG. PROCOLOR X 1 LT.,2025-10-26,products/dfv/reduced/prod_270701_red.jpg,0.00,0.00,0.00,Desc. OSS. LIMPIALAG. PROCOLOR X 1 LT.,Paraclorometaxilenol,Limpialágrimas.,"270701","",2025-12-26 01:02:39.074 -0300,5,1714,1
992,PREDNISOLONA PYO 5 X 180 COMP.,2025-08-07,products/dfv/reduced/prod_325124_red.jpg,0.00,0.00,0.00,Desc. PREDNISOLONA PYO 5 X 180 COMP.,Prednisolona.,Glucocorticoide.,"325124","",2025-12-26 01:02:50.105 -0300,2,1650,1
764,SERENEX REPUESTO FELINO 42 ML,2024-12-04,products/dfv/reduced/prod_170983_red.jpg,0.00,0.00,0.00,Desc. SERENEX REPUESTO FELINO 42 ML,Feromona M2B,"Difusor eléctrico – Feromonoterapia, Feromonas de sincronía que calman y tranquilizan","170983","",2025-12-26 01:01:59.558 -0300,2,1070,1
204,"",2024-05-08,"",0.00,0.00,0.00,Desc. ,"","","120092","",2024-05-09 01:00:50.492 -0300,,8,0
254,"",2024-05-08,"",0.00,0.00,0.00,Desc. ,"","","9982017","",2024-05-09 01:00:54.270 -0300,,3,0
891,CANIS FULLSPOT 05-10 KG.,2025-07-12,products/dfv/reduced/prod_210091_red.jpg,0.00,0.00,0.00,Desc. CANIS FULLSPOT 05-10 KG.,"Imidacloprid, Moxidectina, Praziquantel","Endectocida para el tratamiento, control y prevención de parasitosis externas e internas: Pulgas, garrapatas, nematodes y cestodes.","210091","",2025-12-26 01:02:03.070 -0300,4,1599,1
274,"",2024-05-08,"",0.00,0.00,0.00,Desc. ,"","","9984019","",2024-05-09 01:00:55.013 -0300,,3,0
284,"",2024-05-08,"",0.00,0.00,0.00,Desc. ,"","","9985655","",2024-05-09 01:00:55.270 -0300,,3,0
1242,DOXIGEN MAX X 120 COMP. (12 BL),2025-11-30,enterprises/logo-tecnovax.jpg,0.00,0.00,0.00,Desc. DOXIGEN MAX X 120 COMP. (12 BL),"","","25149","",2025-12-26 01:00:58.480 -0300,1,1763,1
905,CREMA 6A POMO X 30 GR.,2025-07-12,products/dfv/reduced/prod_210150_red.jpg,0.00,0.00,0.00,Desc. CREMA 6A POMO X 30 GR.,"Neomicina 250 mg, Bacitracina 50000 UI, Dexametasona 25 mg, Benzoca_na 1000 mg y Griseofulvina 180 mg","Crema Antibiótica, Antiinflamatoria, Antialérgica, Antipruriginosa, Anestésica y Antimicótica.","210150","",2025-12-26 01:02:05.032 -0300,2,1599,1
1076,OSS. SH. REFRESCANTE X 1 LITRO,2025-10-26,products/dfv/reduced/prod_270191_red.jpg,0.00,0.00,0.00,Desc. OSS. SH. REFRESCANTE X 1 LITRO,"Menta, alcanfor, aloe.",Shampoo refrescante suavizante.,"270191","",2025-12-26 01:02:36.778 -0300,5,1714,1
700,TEA DERMASOFT X 120 ML,2024-12-04,products/dfv/reduced/prod_170135_red.jpg,0.00,0.00,0.00,Desc. TEA DERMASOFT X 120 ML,"DDVP 2,8 g. Cipermetrina 0,8 g.",Antiparasitario externo.,"170135","",2025-12-26 01:01:56.324 -0300,4,1070,1
704,ECP ESTRADIOL X 10 ML,2024-12-04,products/dfv/reduced/prod_170170_red.jpg,0.00,0.00,0.00,Desc. ECP ESTRADIOL X 10 ML,"Estradiol 0,2 g.",Estrógeno de mínima dosis y acción prolongada.,"170170","",2025-12-26 01:01:56.624 -0300,2,1070,1
703,DOMINAL SPRAY X 100 ML.,2024-12-04,products/dfv/reduced/prod_170162_red.jpg,0.00,0.00,0.00,Desc. DOMINAL SPRAY X 100 ML.,"Imidacloprid, Permetrina , Fenoxycarb, Butóxido de piperonil.",Antiparasitario externo.,"170162","",2025-12-26 01:01:56.625 -0300,4,1070,1
1143,OSS. LIMPIALAG. PROCOLOR X 125 ML.,2025-10-26,products/dfv/reduced/prod_270700_red.jpg,0.00,0.00,0.00,Desc. OSS. LIMPIALAG. PROCOLOR X 125 ML.,Paraclorometaxilenol,Limpialágrimas.,"270700","",2025-12-26 01:02:38.959 -0300,5,1714,1
993,PREDNISOLONA PYO 40 X 40 COMP.,2025-08-07,products/dfv/reduced/prod_325126_red.jpg,0.00,0.00,0.00,Desc. PREDNISOLONA PYO 40 X 40 COMP.,Prednisolona.,Glucocorticoide.,"325126","",2025-12-26 01:02:50.040 -0300,2,1650,1
824,BAGOGARD PIP. CANINO H05 KG,2025-05-17,products/dfv/reduced/prod_45113_red.jpg,0.00,0.00,0.00,Desc. BAGOGARD PIP. CANINO H05 KG,"","","45113","",2025-12-26 01:02:53.297 -0300,1,945,1
702,DOMINAL SPRAY X 250 ML.,2024-12-04,products/dfv/reduced/prod_170164_red.jpg,0.00,0.00,0.00,Desc. DOMINAL SPRAY X 250 ML.,"Imidacloprid, Permetrina , Fenoxycarb, Butóxido de piperonil.",Antiparasitario externo.,"170164","",2025-12-26 01:01:56.717 -0300,4,1070,1
786,DOMINAL COLLAR PERRO CACHORRO,2025-02-10,products/dfv/reduced/prod_170173_red.jpg,0.00,0.00,0.00,Desc. DOMINAL COLLAR PERRO CACHORRO,"Propoxur 12,00 g%. Imidacloprid, 5,00 g%. Fenoxicarb, 1,00 g%",Antiparasitario externo.,"170173","",2025-12-26 01:01:56.794 -0300,4,1070,1
741,TEA 327 LIQUIDO X  70 ML,2024-12-04,products/dfv/reduced/prod_170390_red.jpg,0.00,0.00,0.00,Desc. TEA 327 LIQUIDO X  70 ML,"DDVP 2,2 g. Diazinón 2,0 g. ","Infestación por pulgas, garrapatas y piojos.","170390","",2025-12-26 01:01:58.410 -0300,4,1070,1
745,TEA 327 PIP GATO PULGUICIDA H/5KG.,2024-12-04,products/dfv/reduced/prod_170401_red.jpg,0.00,0.00,0.00,Desc. TEA 327 PIP GATO PULGUICIDA H/5KG.,Propoxur 10%,Antiparasitario externo.,"170401","",2025-12-26 01:01:58.585 -0300,4,1070,1
746,TEA 327 PIP PERRO PULG/GARR H/10 KG.,2024-12-04,products/dfv/reduced/prod_170403_red.jpg,0.00,0.00,0.00,Desc. TEA 327 PIP PERRO PULG/GARR H/10 KG.,Propoxur 10%,Antiparasitario externo.,"170403","",2025-12-26 01:01:58.591 -0300,4,1070,1
744,TEA 327 PIP PERRO PULG/GARR H/ 5KG,2024-12-04,products/dfv/reduced/prod_170402_red.jpg,0.00,0.00,0.00,Desc. TEA 327 PIP PERRO PULG/GARR H/ 5KG,Propoxur 10%,Antiparasitario externo.,"170402","",2025-12-26 01:01:58.683 -0300,4,1070,1
1243,DOXIGEN MAX X 60 COMP. (12 BL),2025-11-30,enterprises/logo-tecnovax.jpg,0.00,0.00,0.00,Desc. DOXIGEN MAX X 60 COMP. (12 BL),"","","25150","",2025-12-26 01:00:58.513 -0300,1,1763,1
1077,OSS. SH. REFRESCANTE X 5 LITROS,2025-10-26,products/dfv/reduced/prod_270192_red.jpg,0.00,0.00,0.00,Desc. OSS. SH. REFRESCANTE X 5 LITROS,"Menta, alcanfor, aloe.",Shampoo refrescante suavizante.,"270192","",2025-12-26 01:02:36.901 -0300,5,1714,1
209,"",2024-05-08,"",0.00,0.00,0.00,Desc. ,"","","120301","",2024-05-09 01:00:50.760 -0300,,8,0
249,"",2024-05-08,"",0.00,0.00,0.00,Desc. ,"","","998123","",2024-05-09 01:00:54.000 -0300,,3,0
56,CEFALEXINA 500 MG. HOLL. X 300 COMP.,2024-02-01,products/dfv/reduced/prod_120161_red.jpg,0.00,0.00,0.00,Desc. CEFALEXINA 500 MG. HOLL. X 300 COMP.,Cefalexina Monohidrato: 500 mg,"Antibiótico, bactericida de amplio espectro.","120161","",2025-12-26 01:01:23.229 -0300,2,8,1
1144,OSS. SH. CLORHEXPRO X 250 ML.,2025-10-26,products/dfv/reduced/prod_270702_red.jpg,0.00,0.00,0.00,Desc. OSS. SH. CLORHEXPRO X 250 ML.,Clorhexidina y Propionato de Sodio.,"Shampoo antimicótico, antimicrobiano, bactericida.","270702","",2025-12-26 01:02:39.088 -0300,5,1714,1
300,CALCIO JARABE JM X 100 ML,2024-05-09,products/dfv/reduced/prod_160050_red.jpg,0.00,0.00,0.00,Desc. CALCIO JARABE JM X 100 ML,Gluconato de Calcio 2500 mg. Cloruro de Calcio 1650 mg. Fluoruro de Sodio 4 mg. Cloruro de Magnesio 525 mg. L-Lisina monoclorhidrato 1000 mg. Vit. A 53300 UI.,Calcificante vitamínico.,"160050","",2025-12-26 01:01:51.951 -0300,2,18,1
314,COLOTRIN + HA DOG POMO X 200 GR.,2024-05-09,products/dfv/reduced/prod_160072_red.jpg,0.00,0.00,0.00,Desc. COLOTRIN + HA DOG POMO X 200 GR.,"Condroitín, sulfato sódico 2,00 g, Glucosamina, clorhidrato 3,00 g, Metilsulfonilmetano 5,00 g, Ácido hialurónico, sal sódica 0,15 g, Magnesio cloruro, hexahidrato  0,30 g, Zinc sulfato, heptahidrato 0,07g, Aceite de hígado de bacalao 3,00 g.",Condroprotector.,"160072","",2025-12-26 01:01:52.596 -0300,6,18,1
994,PREDNISOLONA PYO 10 X 100 COMP.,2025-08-07,products/dfv/reduced/prod_325129_red.jpg,0.00,0.00,0.00,Desc. PREDNISOLONA PYO 10 X 100 COMP.,Prednisolona.,Glucocorticoide.,"325129","",2025-12-26 01:02:51.443 -0300,2,1650,1
671,APLONAL 20 MG X 12 COMP,2024-12-04,products/dfv/reduced/prod_1700006_red.jpg,0.00,0.00,0.00,Desc. APLONAL 20 MG X 12 COMP,Flunixin base (como meglumina) 20 mg.,"Analgésico, antipirético, antiendotóxico y antiinflamatorio no esteroide","1700006","",2025-12-26 01:01:54.774 -0300,2,1070,1
185,MELTRA SPOT ON FELINOS DE 4 A 8 KG.,2024-02-16,products/dfv/reduced/prod_60255_red.jpg,0.00,0.00,0.00,Desc. MELTRA SPOT ON FELINOS DE 4 A 8 KG.,Albendazol 9 %,Antiparasitario interno felinos.,"60255","",2025-12-26 01:03:04.626 -0300,3,9,1
578,VETSCAN HM5 KIT TUBOS CONECTORES PACK,2024-05-12,products/dfv/reduced/prod_901670_red.jpg,0.00,0.00,0.00,Desc. VETSCAN HM5 KIT TUBOS CONECTORES PACK,"","","901670","",2025-12-26 01:03:10.156 -0300,9,20,1
145,PRAGMA  5 MG X 20 COMP,2024-02-16,products/dfv/reduced/prod_240657_red.jpg,0.00,0.00,0.00,Desc. PRAGMA  5 MG X 20 COMP,"Benazepril clorhidrato  2,5 mg
Espironolactona  10 mg
Excipientes c.s.p.  500 mg
Cada comprimido de 1000 mg contiene:
Benazepril clorhidrato  5 mg
Espironolactona  20 mg
Excipientes c.s.p.  1000 mg
Cada comprimido de 2000 mg contiene:
Benazepril clorhidrato  10 mg
Espironolactona  40 mg
Excipientes c.s.p.  2000 mg",Inhibidor de la Enzima Convertidora de Angiotensina I y antagonista de la aldosterona.,"240657","",2025-12-26 01:02:07.458 -0300,7,9,1
773,POWER 1 MES GOLD DE 04 A 10 KG,2024-12-10,products/dfv/reduced/prod_2408832_red.jpg,0.00,0.00,0.00,Desc. POWER 1 MES GOLD DE 04 A 10 KG,Fluralaner 100 mg,Control y tratamiento de pulgas y garrapatas en perros durante 30 días con una dosis mínima de 10 mg/kg de Fluralaner.,"2408832","",2025-12-26 01:02:07.867 -0300,1,9,1
642,GIACOCCIDE AMARILLO(H1KG) X 100 COM,2024-10-29,products/dfv/reduced/prod_261055_red.jpg,0.00,0.00,0.00,Desc. GIACOCCIDE AMARILLO(H1KG) X 100 COM,"Dimetridazol 0,016 g. Sulfadimetoxina 0,025 g.","Coccidicida, giardicida, antibacteriano.","261055","",2025-12-26 01:02:08.542 -0300,3,945,1
649,GIACOCCIDE VERDE(1-10KG) X 50 COMP,2024-10-29,products/dfv/reduced/prod_261065_red.jpg,0.00,0.00,0.00,Desc. GIACOCCIDE VERDE(1-10KG) X 50 COMP,"Dimetridazol 0,165 g. Sulfadimetoxina: 0,25 g.","Coccidicida, giardicida, antibacteriano.","261065","",2025-12-26 01:02:08.917 -0300,3,945,1
1145,OSS. SH. CLORHEXPRO X 1 LT.,2025-10-26,products/dfv/reduced/prod_270703_red.jpg,0.00,0.00,0.00,Desc. OSS. SH. CLORHEXPRO X 1 LT.,Clorhexidina y Propionato de Sodio.,"Shampoo antimicótico, antimicrobiano, bactericida.","270703","",2025-12-26 01:02:39.132 -0300,5,1714,1
706,ENERGO-MAG INY. X 250 ML,2024-12-04,products/dfv/reduced/prod_170175_red.jpg,0.00,0.00,0.00,Desc. ENERGO-MAG INY. X 250 ML,Pirrolidón carboxilato de magnesio monohidrato,Controla la hipomagnesemia,"170175","",2025-12-26 01:01:56.761 -0300,2,1070,1
1244,DOXIGEN 100 X 120 COMP. (12 BL),2025-11-30,enterprises/logo-tecnovax.jpg,0.00,0.00,0.00,Desc. DOXIGEN 100 X 120 COMP. (12 BL),"","","25151","",2025-12-26 01:00:58.586 -0300,1,1763,1
