"id","title","date","image","list_price","list_price_2","selling_price","description","active_ingredient","therapeutic_action","distributor_product_id","supplier_product_id","timestamp","category_id","enterprise_supplier_product_id","status"
847,FLEEGARD SPRAY X 300 ML.,2025-07-12,products/dfv/reduced/prod_200870_red.jpg,0.00,0.00,0.00,Desc. FLEEGARD SPRAY X 300 ML.,"CCyfluthrin 0,04%, Piriproxifen 0,05 %, Propelentes c.s.p. 100 %",Butóxido de Piperonilo:    1 g.,"200870","",2025-12-26 01:02:00.249 -0300,2,1598,0
867,FIDER POINT 02-10 KG.,2025-07-12,products/dfv/reduced/prod_210060_red.jpg,0.00,0.00,0.00,Desc. FIDER POINT 02-10 KG.,"Imidacloprid, Permetrina, Piperonil Butóxido.","Antiparasitario externo contra pulgas, garrapatas.","210060","",2025-12-26 01:02:00.911 -0300,4,1599,1
793,LIBRELA 05 A 10KG CAJA X 2 VIALES 5MG.,2025-04-25,products/dfv/reduced/prod_90101_red.jpg,0.00,0.00,0.00,Desc. LIBRELA 05 A 10KG CAJA X 2 VIALES 5MG., Bedinvetmab – Antiinflamatorio / Analgésico monoclonal, Alivio del dolor por osteoartritis,"90101","",2025-12-26 01:03:09.207 -0300,1,20,1
463,ANTIVERRUGAS X 50 ML,2024-05-12,enterprises/Integhra-Logo-CEVA.jpg,0.00,0.00,0.00,Desc. ANTIVERRUGAS X 50 ML,Clorobutanol 50 g,Antisépticos,"262193","",2025-12-26 01:01:05.233 -0300,2,19,1
571,PF VANG PLUS 5L4CV X DOSIS,2024-05-12,products/dfv/reduced/prod_901068_red.jpg,0.00,0.00,0.00,Desc. PF VANG PLUS 5L4CV X DOSIS,"Virus de distemper, adenovirus, parainfluenza, parvo, corona y leptospira caninos (4 serovares).",Vacuna septuple con lepto y corona virus canina.,"901068","",2025-12-26 01:03:09.875 -0300,11,20,1
573,PF VANG PLUS CPVCV X DOSIS,2024-05-12,products/dfv/reduced/prod_901070_red.jpg,0.00,0.00,0.00,Desc. PF VANG PLUS CPVCV X DOSIS,Virus de parvo y corona caninos.,Vacuna líquida para la prevención de Parvovirosis y Coronavirosis caninas.,"901070","",2025-12-26 01:03:09.952 -0300,11,20,1
898,CANIS ENDOSPOT 26-40 KG.,2025-07-12,products/dfv/reduced/prod_210098_red.jpg,0.00,0.00,0.00,Desc. CANIS ENDOSPOT 26-40 KG.,"Moxidectina, Praziquantel","Endoparasiticida para el tratamiento, control y prevención de parasitosis  internas:  nematodes y cestodes.","210098","",2025-12-26 01:02:04.618 -0300,3,1599,1
162,KIL P-G TALCO X 100 GR,2024-02-16,products/dfv/reduced/prod_60170_red.jpg,0.00,0.00,0.00,Desc. KIL P-G TALCO X 100 GR,Carbaryl 5 %,"Pulguicida y garrapaticida, para caninos y felinos.","60170","",2025-12-26 01:03:00.585 -0300,4,9,1
521,FULL HEPAT 50MG X 30 COMP.,2024-05-12,products/dfv/reduced/prod_262907_red.jpg,0.00,0.00,0.00,Desc. FULL HEPAT 50MG X 30 COMP.,"Cada comprimido contiene: Ácido Ursodesoxicólico 50 mg, Silimarina 50 mg, Excipientes c.s.p.1 comprimido (ursomarina)","Indicado en casos en donde sea necesario mejorar la digestión de alimentos, principalmente aquellos ricos en grasas. Favorece la funcionalidad hepática protegiendo la integridad del hepatocito mediante propiedades antioxidantes. En casos donde la funcionalidad hepática se encuentre comprometida, indigestiones, animales obesos, animales que presentan alteraciones en los parámetros bioquímicos del metabolismo de las grasas.","262907","",2025-11-26 01:01:57.747 -0300,2,19,1
1010,DERMOSEDAN MRSA NANO AG X 50 ML,2025-08-07,enterprises/logo-idv.png,0.00,0.00,0.00,Desc. DERMOSEDAN MRSA NANO AG X 50 ML,"","","325654","",2025-12-26 01:01:27.570 -0300,5,1650,1
128,ANFOTROPINA INY X 100 ML.,2024-02-16,products/dfv/reduced/prod_240376_red.jpg,0.00,0.00,0.00,Desc. ANFOTROPINA INY X 100 ML.,"Hexametilentetramina  40.00 g, Ácido canfórico 2.00 g","Antiséptico general de acción sistémica. Bacteriostático, bactericida, antiséptico y antiflogístico","240376","",2025-12-26 01:02:06.566 -0300,2,9,1
1022,ECTHOLANER 20 A 40 KG X 2 COMP. 1200 MG,2025-10-03,products/dfv/reduced/prod_120338_red.jpg,0.00,0.00,0.00,Desc. ECTHOLANER 20 A 40 KG X 2 COMP. 1200 MG,Fluralaner,"Actúa contra pulgas y garrapatas con acción prolongada (hasta 90 días). Mata las pulgas antes de que pongan huevos, ofrece protección en el animal y en el ambiente, y disminuye el riesgo de enfermedades transmitidas por vectores. Puede usarse en perros desde las 8 semanas y a partir de 2?kg. Incluso en razas con mutación MDR?1, hembras gestantes o en lactancia.","120338","",2025-12-26 01:01:35.290 -0300,4,8,1
81,TOTAL FULL LC H/10 KG. X 2 COMP. PALAT.,2024-02-01,products/dfv/reduced/prod_120350_red.jpg,0.00,0.00,0.00,Desc. TOTAL FULL LC H/10 KG. X 2 COMP. PALAT.,Praziquantel 25 mg. Pirantel base (Como Pamoato) 25 mg. Fenbendazol 250 mg.,Antiparasitario interno palatable de amplio espectro. Sistema de Liberación Prolongada.,"120350","",2025-12-26 01:01:38.409 -0300,3,8,1
1106,OSS. LOCION ATOMIZ. CAMILO X 50 ML,2025-10-26,products/dfv/reduced/prod_270332_red.jpg,0.00,0.00,0.00,Desc. OSS. LOCION ATOMIZ. CAMILO X 50 ML,"Alcohol de cereal, perfume.",Loción desodorante.,"270332","",2025-12-26 01:02:37.699 -0300,5,1714,1
868,FIDER POINT 21-40 KG.,2025-07-12,products/dfv/reduced/prod_210062_red.jpg,0.00,0.00,0.00,Desc. FIDER POINT 21-40 KG.,"Imidacloprid, Permetrina, Piperonil Butóxido.","Antiparasitario externo contra pulgas, garrapatas.","210062","",2025-12-26 01:02:01.034 -0300,4,1599,1
722,REPEXXIN COLLAR DE 25 A 60 KG,2024-12-04,products/dfv/reduced/prod_170282_red.jpg,0.00,0.00,0.00,Desc. REPEXXIN COLLAR DE 25 A 60 KG,"Deltametrina 4,0 g., Propoxur 10,0 g",Collar repelente e insecticida,"170282","",2025-12-26 01:01:57.433 -0300,4,1070,1
1205,FIPROGEN ULTRA 10 A 20 KG X 2 ML,2025-11-30,enterprises/logo-tecnovax.jpg,0.00,0.00,0.00,Desc. FIPROGEN ULTRA 10 A 20 KG X 2 ML,"","","25116","",2025-12-26 01:00:57.399 -0300,1,1763,1
900,GERIOOX X 120 COMP,2025-07-12,products/dfv/reduced/prod_210102_red.jpg,0.00,0.00,0.00,Desc. GERIOOX X 120 COMP,Idem.,"Geriátrico, antioxidante, mejora las funciones vitales del cuerpo, condroprotector.","210102","",2025-12-26 01:02:04.876 -0300,2,1599,1
599,FLUIDO SPINEDA X 250 ML (L.V),2024-09-19,"",0.00,0.00,0.00,Desc. FLUIDO SPINEDA X 250 ML (L.V),"","","3500001","",2025-12-26 01:01:28.882 -0300,2,707,1
1171,OSS. CR. ENJUAGUE OMEGA CHOCOLATE X 1 LT,2025-10-26,products/dfv/reduced/prod_270805_red.jpg,0.00,0.00,0.00,Desc. OSS. CR. ENJUAGUE OMEGA CHOCOLATE X 1 LT,"","","270805","",2025-12-26 01:02:39.639 -0300,1,1714,1
848,ADVANTAGE GATO H4 KG X 1 PIP.,2025-07-12,products/dfv/prod_200858_integhra.jpg,0.00,0.00,0.00,Desc. ADVANTAGE GATO H4 KG X 1 PIP.,Imidacloprid 10%,Antiparasitario externo,"200858","",2025-12-26 01:02:00.201 -0300,4,1598,1
851,DRONTAL PLUS SABORIZADO X 2 COMP.,2025-07-12,products/dfv/prod_20123_integhra.jpg,0.00,0.00,0.00,Desc. DRONTAL PLUS SABORIZADO X 2 COMP.,"Cada tableta contiene: Pyrantel, emboato: 144 mg + Praziquantel: 50 mg. + Febantel: 150 mg.",Antiparasitario interno de amplio espectro.,"20123","",2025-12-26 01:02:00.385 -0300,3,1598,1
1039,OSS. SH. PER. DE BENZOILO X 1 LT.,2025-10-26,products/dfv/reduced/prod_270026_red.jpg,0.00,0.00,0.00,Desc. OSS. SH. PER. DE BENZOILO X 1 LT.,Peróxido de benzoílo.,"Shampoo, antiséptico, antimicrobiano, queratolítico, antipruriginoso.","270026","",2025-12-26 01:02:35.922 -0300,5,1714,1
806,EQVALAN GOLD PASTA X 1 JGA.,2025-05-08,products/dfv/reduced/prod_90051_red.jpg,0.00,0.00,0.00,Desc. EQVALAN GOLD PASTA X 1 JGA.,"Ivermectina 1,55 g. Praziquantel 7,75 g.",Antiparasitario interno de amplio espectro.,"90051","",2025-12-26 01:03:09.265 -0300,3,1513,1
922,FIPRO LABYES GATO,2025-07-12,products/dfv/reduced/prod_210254_red.jpg,0.00,0.00,0.00,Desc. FIPRO LABYES GATO,Fipronil,"Antiparasitario externo contra pulgas, garrapatas.","210254","",2025-12-26 01:02:05.348 -0300,4,1599,1
5,ATRIBEN INYECTABLE X 20 ML,2024-02-01,products/dfv/reduced/prod_120012_red.jpg,0.00,0.00,0.00,Desc. ATRIBEN INYECTABLE X 20 ML,Triamcinolona 6 mg. Vehículo c.s.p. 1 ml.,Antiinflamatorio glucocorticoide de depósito.,"120012","",2025-12-26 01:00:45.817 -0300,2,8,1
800,AMINO-LITE BOEHRINGER X 250 ML.,2025-05-08,enterprises/Logo-Boehringer-verde-circular.png,0.00,0.00,0.00,Desc. AMINO-LITE BOEHRINGER X 250 ML.,Dextrosa al 5 % como fuente de energía. Complejo Vitamina B. ,Solución electrolítica.,"230001","",2025-12-26 01:00:54.532 -0300,2,1513,1
941,CREDELIO PACK X 3 H/ 45 KG. 900 MG.,2025-07-12,products/dfv/prod_81032_integhra.jpg,0.00,0.00,0.00,Desc. CREDELIO PACK X 3 H/ 45 KG. 900 MG.,Lotilaner.,Pulguicida y Garrapaticida  Perros,"81032","",2025-12-26 01:01:33.553 -0300,4,1598,1
276,"",2024-05-08,"",0.00,0.00,0.00,Desc. ,"","","998405","",2024-05-09 01:00:55.039 -0300,,3,0
923,OCUBIOTIC CON ESTEROIDES X 5 ML.,2025-07-12,products/dfv/reduced/prod_210500_red.jpg,0.00,0.00,0.00,Desc. OCUBIOTIC CON ESTEROIDES X 5 ML.,"Bacitracina 400 UI, Neomicina 5 mg, Polimixina B 10000 UI, Benzocaína 10 mg, Hidrocortisona 10 mg","Colirio antibiótico, antiinflamatorio, analgésico, antipruriginoso, anestésico.","210500","",2025-12-26 01:02:05.369 -0300,2,1599,1
1206,FIPROGEN ULTRA 20 A 40 KG X 4 ML,2025-11-30,enterprises/logo-tecnovax.jpg,0.00,0.00,0.00,Desc. FIPROGEN ULTRA 20 A 40 KG X 4 ML,"","","25115","",2025-12-26 01:00:57.359 -0300,1,1763,1
522,CLAMOXYL L.A. INY. X 100 ML,2024-05-12,products/dfv/reduced/prod_283065_red.jpg,0.00,0.00,0.00,Desc. CLAMOXYL L.A. INY. X 100 ML,Amoxicilina.,Antibiótico de larga acción.,"283065","",2025-12-26 01:02:40.171 -0300,2,20,1
163,FENOBARBITAL P-G 40 MG. X 30 COMP.,2024-02-16,products/dfv/reduced/prod_60171_red.jpg,0.00,0.00,0.00,Desc. FENOBARBITAL P-G 40 MG. X 30 COMP.,Fenobarbital 40 mg / comp,Anticonvulsivante,"60171","",2025-12-26 01:03:00.397 -0300,2,9,1
797,MULTIVIT BOEHRINGER X 500 ML.,2025-05-08,enterprises/Logo-Boehringer-verde-circular.png,0.00,0.00,0.00,Desc. MULTIVIT BOEHRINGER X 500 ML.,"","","230003","",2025-12-26 01:00:54.557 -0300,2,1513,1
89,TOTAL FULL LC GATOS X 2 COMP. PALAT.,2024-02-01,products/dfv/reduced/prod_120353_red.jpg,0.00,0.00,0.00,Desc. TOTAL FULL LC GATOS X 2 COMP. PALAT.,Praziquantel 20 mg. Pirantel base (Como Pamoato) 80 mg. Fenbendazol 200 mg.,Antiparasitario interno palatable de amplio espectro. Sistema de Liberación Prolongada.,"120353","",2025-12-26 01:01:40.574 -0300,3,8,1
129,POWER COMP. GATO/PERRO  5 A 10 KG X 1C,2024-02-16,products/dfv/reduced/prod_240397_red.jpg,0.00,0.00,0.00,Desc. POWER COMP. GATO/PERRO  5 A 10 KG X 1C,Spinosad 150 mg /300 mg/600 mg /900 mg /1200 mg  (según  presentación),Pulguicida sistémico.,"240397","",2025-12-26 01:02:06.509 -0300,4,9,1
1011,DERMOSEDAN ODORLESS CHAMPU X 200 ML,2025-08-07,enterprises/logo-idv.png,0.00,0.00,0.00,Desc. DERMOSEDAN ODORLESS CHAMPU X 200 ML,"","","325656","",2025-12-26 01:01:27.587 -0300,5,1650,1
564,PF GIARDIA VAX X DOSIS,2024-05-12,products/dfv/reduced/prod_901014_red.jpg,0.00,0.00,0.00,Desc. PF GIARDIA VAX X DOSIS,Trofozoitos inactivados de Giardia lamblia.,Vacuna.,"901014","",2025-12-26 01:03:09.254 -0300,11,20,1
1023,ECTHOLANER MAS DE 40 KG X 4 COMP. 1200MG,2025-10-03,products/dfv/reduced/prod_120339_red.jpg,0.00,0.00,0.00,Desc. ECTHOLANER MAS DE 40 KG X 4 COMP. 1200MG,"","Actúa contra pulgas y garrapatas con acción prolongada (hasta 90 días). Mata las pulgas antes de que pongan huevos, ofrece protección en el animal y en el ambiente, y disminuye el riesgo de enfermedades transmitidas por vectores. Puede usarse en perros desde las 8 semanas y a partir de 2?kg. Incluso en razas con mutación MDR?1, hembras gestantes o en lactancia.","120339","",2025-12-26 01:01:38.210 -0300,4,8,1
784,BASKEN HOSP. DOBLE 60 X 60 COMP.,2025-02-04,products/dfv/reduced/prod_1701003_red.jpg,0.00,0.00,0.00,Desc. BASKEN HOSP. DOBLE 60 X 60 COMP.,"","","1701003","",2025-12-26 01:01:55.993 -0300,1,1070,1
1040,OSS. SH. PER. DE BENZOILO X 5 LT.,2025-10-26,products/dfv/reduced/prod_270027_red.jpg,0.00,0.00,0.00,Desc. OSS. SH. PER. DE BENZOILO X 5 LT.,Peróxido de benzoílo.,"Shampoo, antiséptico, antimicrobiano, queratolítico, antipruriginoso.","270027","",2025-12-26 01:02:35.922 -0300,5,1714,1
1107,DELANTAL BORDADOS OSSPRET,2025-10-26,enterprises/Osspret-logo_IFJyAFN.jpg,0.00,0.00,0.00,Desc. DELANTAL BORDADOS OSSPRET,"","","270334","",2025-12-26 01:01:11.901 -0300,9,1714,1
8,TOTAL FULL GATOS SUSP. X 15 ML.,2024-02-01,products/dfv/reduced/prod_120016_red.jpg,0.00,0.00,0.00,Desc. TOTAL FULL GATOS SUSP. X 15 ML.,Praziquantel 5 mg. Pirantel base (Como Pamoato) 20 mg. Fenbendazol 50 mg,Antiparasitario interno de amplio espectro.,"120016","",2025-12-26 01:00:45.509 -0300,3,8,1
849,K-OTHRINA FOG 220 CM3 / 128 GR.,2025-07-12,enterprises/Logo_elanco.jpg,0.00,0.00,0.00,Desc. K-OTHRINA FOG 220 CM3 / 128 GR.,"","","200902","",2025-12-26 01:00:47.872 -0300,2,1598,0
723,SUPER SHAMPOO PERROS X 250,2024-12-04,products/dfv/reduced/prod_170295_red.jpg,0.00,0.00,0.00,Desc. SUPER SHAMPOO PERROS X 250,"Piretrinas naturales 0,1 g. But_xido de Piperonilo 1g. N-octyl bicicloheptene dicarboximida 0,5 g",Antiparasitario externo.,"170295","",2025-12-26 01:01:57.464 -0300,4,1070,1
1172,OSS. SH. ALGAS VITALIZADOR X 5 LITROS,2025-10-26,products/dfv/reduced/prod_270850_red.jpg,0.00,0.00,0.00,Desc. OSS. SH. ALGAS VITALIZADOR X 5 LITROS,"Parahidroxibenzoato de metilo, alantoína y_extracto de algas.","Shampoo antiséptico, antipruriginoso y abrillantador.","270850","",2025-12-26 01:02:39.680 -0300,5,1714,1
854,ADVANTIX X 1 PIP H/25,2025-07-12,products/dfv/prod_20394_integhra.jpg,0.00,0.00,0.00,Desc. ADVANTIX X 1 PIP H/25,Imidacloprid 10 % Permetrina 50 %,"Antiparasitario externo, Pulguicida, Garrapaticida, Repelente de insectos","20394","",2025-12-26 01:02:00.523 -0300,4,1598,1
869,FIDER POINT 41-60 KG.,2025-07-12,products/dfv/reduced/prod_210063_red.jpg,0.00,0.00,0.00,Desc. FIDER POINT 41-60 KG.,"Imidacloprid, Permetrina, Piperonil Butóxido.","Antiparasitario externo contra pulgas, garrapatas.","210063","",2025-12-26 01:02:01.044 -0300,4,1599,1
906,CREMA 6A AEROSOL X 80 ML.,2025-07-12,products/dfv/reduced/prod_210151_red.jpg,0.00,0.00,0.00,Desc. CREMA 6A AEROSOL X 80 ML.,"Neomicina 500 mg, Bacitracina 40000 UI , Dexametasona 25 mg, y Griseofulvina. 96 mg","Crema Antibiótica, Antiinflamatoria, Antialérgica, Antipruriginosa, Anestésica y Antimicótica.","210151","",2025-12-26 01:02:05.066 -0300,2,1599,1
1012,CEFALEXINA SEPSIS 500 X 80 COMP,2025-08-07,enterprises/logo-idv.png,0.00,0.00,0.00,Desc. CEFALEXINA SEPSIS 500 X 80 COMP,"","","325999","",2025-12-26 01:01:27.639 -0300,2,1650,1
1207,FIPROGEN ULTRA 05 A 10 KG X 1 ML,2025-11-30,enterprises/logo-tecnovax.jpg,0.00,0.00,0.00,Desc. FIPROGEN ULTRA 05 A 10 KG X 1 ML,"","","25117","",2025-12-26 01:00:57.424 -0300,1,1763,1
602,COAGULANTE CHINFIELD X 10 ML.,2024-09-19,"",0.00,0.00,0.00,Desc. COAGULANTE CHINFIELD X 10 ML.,"","","350102","",2025-12-26 01:01:29.095 -0300,2,707,1
164,MELTRA SUSPENSION X 15 ML,2024-02-16,products/dfv/reduced/prod_60175_red.jpg,0.00,0.00,0.00,Desc. MELTRA SUSPENSION X 15 ML,Metronidazol 250 mg. Azitromicina 100 mg / comp,Antiparasitario interno,"60175","",2025-12-26 01:02:59.977 -0300,3,9,1
809,PANTOLIV 20 MG X 30 COMP.,2025-05-13,products/dfv/reduced/prod_160332_red.jpg,0.00,0.00,0.00,Desc. PANTOLIV 20 MG X 30 COMP.,Pantoprazol (como pantoprazol sódico sesquihidrato) 20?mg,"Inhibidor de la bomba de protones (IBP). Reduce la secreción ácida gástrica, indicado para tratar y prevenir hiperacidez, gastritis, esofagitis, úlceras gástricas y duodenales, y erosiones inducidas por medicamentos ulcerogénicos.","160332","",2025-12-26 01:01:54.527 -0300,1,18,1
725,SINGESTAR INY. JERINGA X 1 ML,2024-12-04,products/dfv/reduced/prod_170320_red.jpg,0.00,0.00,0.00,Desc. SINGESTAR INY. JERINGA X 1 ML,"Tiabendazol 4 g. Triamcinolona acetonida 0,1 g. Neomicina base (como sulfato) 0,288 g ",Prevención o anulación del celo durante el anestro. ,"170320","",2025-12-26 01:01:57.474 -0300,2,1070,1
850,DRONTAL PLUS 35 SAB. X 1 COMP,2025-07-12,products/dfv/prod_20122_integhra.jpg,0.00,0.00,0.00,Desc. DRONTAL PLUS 35 SAB. X 1 COMP,Cada tableta contiene: Febantel 525 mg + Pyrantel Embonato 504 + Praziquantel 175 mg,Antiparasitario interno de amplio espectro.,"20122","",2025-12-26 01:02:00.321 -0300,3,1598,1
792,LIBRELA 10 A 20KG CAJA X 2 VIALES 10MG.,2025-04-25,products/dfv/reduced/prod_90102_red.jpg,0.00,0.00,0.00,Desc. LIBRELA 10 A 20KG CAJA X 2 VIALES 10MG.,Bedinvetmab – Antiinflamatorio / Analgésico monoclonal, Alivio del dolor por osteoartritis,"90102","",2025-12-26 01:03:09.388 -0300,1,20,1
85,OL TRANS FLEX X 21 CS,2024-02-01,products/dfv/reduced/prod_120358_red.jpg,0.00,0.00,0.00,Desc. OL TRANS FLEX X 21 CS,"Glucosamina Sulfato 440 mg.
Metilsulfonilmetano (MSM) 400 mg.
Ácido Ascórbico 66 mg.
Manganeso Gluconato 10 mg",Coadyuvante osteoarticular en comprimidos palatables,"120358","",2025-12-26 01:01:40.401 -0300,6,8,1
855,ADVANTIX X 1 PIP H/10,2025-07-12,products/dfv/prod_20395_integhra.jpg,0.00,0.00,0.00,Desc. ADVANTIX X 1 PIP H/10,Imidacloprid 10 % Permetrina 50 %,"Antiparasitario externo, Pulguicida, Garrapaticida, Repelente de insectos","20395","",2025-12-26 01:02:00.531 -0300,4,1598,1
1041,OSS. SH. AQUA ECTO PG X 250 ML,2025-10-26,products/dfv/reduced/prod_270029_red.jpg,0.00,0.00,0.00,Desc. OSS. SH. AQUA ECTO PG X 250 ML,"Reguladores del ph, cipermetrina, d-limoneno y glicerina.",Shampoo pulguicida y garrapaticida.,"270029","",2025-12-26 01:02:36.043 -0300,5,1714,1
1173,OSS. SH. PULG Y GARRAP CAJA EXHIB 8X70ML,2025-10-26,enterprises/Osspret-logo_IFJyAFN.jpg,0.00,0.00,0.00,Desc. OSS. SH. PULG Y GARRAP CAJA EXHIB 8X70ML,"Shampoo para cachorros, Pulguicida, Garrapaticida con glicerina.","Base de lavado suave, reguladores de ph, Cipermetrina 0,15%, D-Limoneno y Glicerina.","270881","",2025-12-26 01:01:14.483 -0300,5,1714,1
52,OHM JERINGA X 7G (PASTA P/GATOS),2024-02-01,products/dfv/reduced/prod_120122_red.jpg,0.00,0.00,0.00,Desc. OHM JERINGA X 7G (PASTA P/GATOS),"Triptofano 100 mg
Extracto de raíz de Valeriana 50 mg
Teanina 7,5 mg",Biomodulador coadyuvante en el manejo de la ansiedad en pasta palatable.,"120122","",2025-12-26 01:01:20.601 -0300,2,8,1
1108,OSS. SH. IODOPOVIDONA X 250 ML,2025-10-26,products/dfv/reduced/prod_270335_red.jpg,0.00,0.00,0.00,Desc. OSS. SH. IODOPOVIDONA X 250 ML,Iodopovidona.,"Shampoo antiséptico, batericida, viricida, fungicida y desinfectante._","270335","",2025-12-26 01:02:37.705 -0300,5,1714,1
93,DOZILAM (MIDAZOLAM 5 MG) X 10 ML.,2024-02-01,products/dfv/reduced/prod_120501_red.jpg,0.00,0.00,0.00,Desc. DOZILAM (MIDAZOLAM 5 MG) X 10 ML.,Midazolam 5 mg/ml.,"Benzodiacepina de acción corta que produce sedación/hipnosis, ansiólisis, relajación muscular y tiene acción anticonvulsivante.","120501","",2025-12-26 01:01:47.616 -0300,2,8,1
333,RANITIDINA 20 INY. X 50 ML,2024-05-09,products/dfv/reduced/prod_1602045_red.jpg,0.00,0.00,0.00,Desc. RANITIDINA 20 INY. X 50 ML,Ranitidina,Antiácido.,"1602045","",2025-12-26 01:01:53.654 -0300,2,18,1
343,TONICO TOTAL X 900 ML,2024-05-09,products/dfv/reduced/prod_160230_red.jpg,0.00,0.00,0.00,Desc. TONICO TOTAL X 900 ML,"Vitaminas, aminoácidos y minerales.",Reconstituyente polivitamínico y mineral.,"160230","",2025-12-26 01:01:54.003 -0300,2,18,1
1013,DERMOSEDAN CREMA ENJUAGUE X 200 ML,2025-08-07,enterprises/logo-idv.png,0.00,0.00,0.00,Desc. DERMOSEDAN CREMA ENJUAGUE X 200 ML,"","","325659","",2025-12-26 01:01:27.610 -0300,5,1650,1
1042,OSS. SH. AQUA ECTO PG X 1 LITRO,2025-10-26,products/dfv/reduced/prod_270030_red.jpg,0.00,0.00,0.00,Desc. OSS. SH. AQUA ECTO PG X 1 LITRO,Idem.,Shampoo pulguicida y garrapaticida.,"270030","",2025-12-26 01:02:36.066 -0300,5,1714,1
1208,FIPROGEN ULTRA 02 A 05 KG X 0.5 ML,2025-11-30,enterprises/logo-tecnovax.jpg,0.00,0.00,0.00,Desc. FIPROGEN ULTRA 02 A 05 KG X 0.5 ML,"","","25118","",2025-12-26 01:00:57.467 -0300,1,1763,1
1109,OSS. SH. IODOPOVIDONA X 5 LITROS,2025-10-26,products/dfv/reduced/prod_270336_red.jpg,0.00,0.00,0.00,Desc. OSS. SH. IODOPOVIDONA X 5 LITROS,Iodopovidona.,"Shampoo antiséptico, batericida, viricida, fungicida y desinfectante._","270336","",2025-12-26 01:02:37.757 -0300,5,1714,1
166,MELTRA ENDECTOCIDA X 500 CC.,2024-02-16,products/dfv/reduced/prod_60176_red.jpg,0.00,0.00,0.00,Desc. MELTRA ENDECTOCIDA X 500 CC.,Ivermectina 1%,Antiparasitario externo e interno.,"60176","",2025-12-26 01:03:01.292 -0300,3,9,1
173,TERPAN 1000E INSEC.AMB.X 1LT.,2024-02-16,products/dfv/reduced/prod_60203_red.jpg,0.00,0.00,0.00,Desc. TERPAN 1000E INSEC.AMB.X 1LT.,"Cipermetrina 5,6 %. Diazinón 56%",Insecticida ambiental.,"60203","",2025-12-26 01:03:02.603 -0300,5,9,1
177,POWER MET GATO H/8 KG,2024-02-16,products/dfv/reduced/prod_60242_red.jpg,0.00,0.00,0.00,Desc. POWER MET GATO H/8 KG,"Imidacloprid 0,5 g. Permetrina 2 g.","Pulguicida, Ovicida, Larvicida.","60242","",2025-12-26 01:03:03.068 -0300,4,9,1
791,LIBRELA 20 A 30KG CAJA X 2 VIALES 15MG.,2025-04-25,products/dfv/reduced/prod_90104_red.jpg,0.00,0.00,0.00,Desc. LIBRELA 20 A 30KG CAJA X 2 VIALES 15MG.,Bedinvetmab – Antiinflamatorio / Analgésico monoclonal, Alivio del dolor por osteoartritis,"90104","",2025-12-26 01:03:09.346 -0300,1,20,1
1174,OSS. JABON LIQ. C/GLICERINA X 1LTO.,2025-10-26,enterprises/Osspret-logo_IFJyAFN.jpg,0.00,0.00,0.00,Desc. OSS. JABON LIQ. C/GLICERINA X 1LTO.,Higiene en general.,Glicerina y base de lavado,"270882","",2025-12-26 01:01:14.566 -0300,5,1714,1
92,BUTORMIN INY. X 10 ML,2024-02-01,products/dfv/reduced/prod_120800_red.jpg,0.00,0.00,0.00,Desc. BUTORMIN INY. X 10 ML,Butorfanol 10 mg/ml.,Analgésico opioide.,"120800","",2025-12-26 01:01:49.099 -0300,2,8,1
810,SENIORLINE CATS X 60 COMP.,2025-05-13,products/dfv/reduced/prod_160334_red.jpg,0.00,0.00,0.00,Desc. SENIORLINE CATS X 60 COMP.,"Arándano, pared celular de levadura, ácido fólico, vitaminas.","Salud renal, digestiva e inmune.","160334","",2025-12-26 01:01:54.492 -0300,1,18,1
232,"",2024-05-08,"",0.00,0.00,0.00,Desc. ,"","","590301","",2024-05-09 01:00:53.207 -0300,,8,0
242,"",2024-05-08,"",0.00,0.00,0.00,Desc. ,"","","998090","",2024-05-09 01:00:53.904 -0300,,3,0
252,"",2024-05-08,"",0.00,0.00,0.00,Desc. ,"","","9982007","",2024-05-09 01:00:54.177 -0300,,3,0
262,"",2024-05-08,"",0.00,0.00,0.00,Desc. ,"","","9982205","",2024-05-09 01:00:54.477 -0300,,3,0
217,"",2024-05-08,"",0.00,0.00,0.00,Desc. ,"","","120430","",2024-05-09 01:00:50.743 -0300,,8,0
168,ARTRIN (PALATABLE) X 30 COMP.,2024-02-16,products/dfv/reduced/prod_60181_red.jpg,0.00,0.00,0.00,Desc. ARTRIN (PALATABLE) X 30 COMP.,Glucosamina sulfato 500 mg. Condroitín sulfato 100 mg. Manganeso sulfato 10 mg / comp,"Condroprotector, regenerador articular (similar al sosten cg)","60181","",2025-12-26 01:03:02.142 -0300,6,9,1
728,SINGESTAR X 8 COMP,2024-12-04,products/dfv/reduced/prod_170340_red.jpg,0.00,0.00,0.00,Desc. SINGESTAR X 8 COMP,Acetato de Megestrol 20 mg.,"Prevención o anulación del celo, tratamiento de tumores estrógeno dependientes. ","170340","",2025-12-26 01:01:57.626 -0300,2,1070,1
852,DRONTAL GATOS X 2 COMP,2025-07-12,products/dfv/prod_20125_integhra.jpg,0.00,0.00,0.00,Desc. DRONTAL GATOS X 2 COMP,Cada tableta cont: Pirantel 230 mg. + Praziquantel 20 mg.,Antiparasitario interno de amplio espectro.,"20125","",2025-12-26 01:02:00.359 -0300,3,1598,1
1209,ECTOGEN PLUS GATOS H-9 KG X 0.96 ML,2025-11-30,enterprises/logo-tecnovax.jpg,0.00,0.00,0.00,Desc. ECTOGEN PLUS GATOS H-9 KG X 0.96 ML,"","","25119","",2025-12-26 01:00:57.475 -0300,1,1763,1
566,PF FELOCELL 3 X DOSIS,2024-05-12,products/dfv/reduced/prod_901045_red.jpg,0.00,0.00,0.00,Desc. PF FELOCELL 3 X DOSIS,"Virus vivos modificados de: parvo, rinotraqueítis, calcivirosis felinos.",Vacuna triple felina.,"901045","",2025-12-26 01:03:09.685 -0300,11,20,1
94,ENDECTOCIDA X 10 COMP.(BLISTER),2024-02-01,products/dfv/reduced/prod_120900_red.jpg,0.00,0.00,0.00,Desc. ENDECTOCIDA X 10 COMP.(BLISTER),Ivermectina 5 mg/comprimido,Antiparasitario endectocida,"120900","",2025-12-26 01:01:49.726 -0300,4,8,1
856,ADVANTIX X 1 PIP H/40,2025-07-12,products/dfv/prod_20397_integhra.jpg,0.00,0.00,0.00,Desc. ADVANTIX X 1 PIP H/40,Imidacloprid 10 % Permetrina 50 %,"Antiparasitario externo, Pulguicida, Garrapaticida, Repelente de insectos","20397","",2025-12-26 01:02:00.564 -0300,4,1598,1
1043,OSS. SH. AMITRAZ 0.25 % X 250 ML.,2025-10-26,products/dfv/reduced/prod_270031_red.jpg,0.00,0.00,0.00,Desc. OSS. SH. AMITRAZ 0.25 % X 250 ML.,"Amitraz, d-Limoneno, Glicerina.","Shampoo antisárnico, garrapaticida y pulguicida","270031","",2025-12-26 01:02:36.055 -0300,5,1714,1
1175,OSS. IODOPOV. SOL. 5% X  5LTS,2025-10-26,enterprises/Osspret-logo_IFJyAFN.jpg,0.00,0.00,0.00,Desc. OSS. IODOPOV. SOL. 5% X  5LTS,Iodopovidona.,Antiséptico para diversos usos.,"270880","",2025-12-26 01:01:14.412 -0300,5,1714,1
777,ECTHONIL PERROS 11 A 15 KG,2024-12-23,products/dfv/reduced/prod_1201114_red.jpg,0.00,0.00,0.00,Desc. ECTHONIL PERROS 11 A 15 KG,Fipronil: 1.00 g.  Imidacloprid: 10.00 g.  Piriproxifen: 1.00 g.  Etofenprox: 10.00 g.  Excipientes: c.s.p,"Antiparasitario externo pulguicida, garrapaticida y control ambiental. Administración: De 11 a 15 kg: 1 pipeta de 1,5 ml.","1201114","",2025-12-26 01:01:16.807 -0300,1,8,1
329,HEPATOPROTECTOR J. MARTIN GOT. X 15 ML,2024-05-09,products/dfv/reduced/prod_160160_red.jpg,0.00,0.00,0.00,Desc. HEPATOPROTECTOR J. MARTIN GOT. X 15 ML,"Bitartrato de Colina 1 g. D-L Metionina, Extracto de Peumus Boldus, Extracto de Cynara Scolymus,  Extracto de Rhamnus Prushiana, Metilbromuro de Homatropina ",Modificador orgánico.,"160160","",2025-12-26 01:01:53.308 -0300,2,18,1
1110,OSS. GROOMERS SH. MEDIC JOJOBA X 250 ML,2025-10-26,products/dfv/reduced/prod_270340_red.jpg,0.00,0.00,0.00,Desc. OSS. GROOMERS SH. MEDIC JOJOBA X 250 ML,"Alantoína, Irgasan DP 300 y Aceite de Jojoba",Shampoo hipoalergénico.,"270340","",2025-12-26 01:02:37.859 -0300,5,1714,1
820,BAGOGARD PIP. CANINO H25 KG,2025-05-17,products/dfv/reduced/prod_45116_red.jpg,0.00,0.00,0.00,Desc. BAGOGARD PIP. CANINO H25 KG,"","","45116","",2025-12-26 01:02:53.805 -0300,1,945,1
294,"",2024-05-08,"",0.00,0.00,0.00,Desc. ,"","","9987102","",2024-05-09 01:00:55.555 -0300,,3,0
214,"",2024-05-08,"",0.00,0.00,0.00,Desc. ,"","","120306","",2024-05-09 01:00:50.724 -0300,,8,0
